<?xml version="1.0" encoding="UTF-8"?>
<!DOCTYPE Magacin SYSTEM "magacin.dtd">
<Magacin>
<Artikal>
	<Naziv sifraArtikla=""></Naziv>
	<DatumIzrade>
		<Dan></Dan>
		<Mesec></Mesec>
		<Godina></Godina>
	</DatumIzrade>
	<Cena tipCene="dinar"></Cena>
	<Kompanija>
		<Ime></Ime>
		<Adresa></Adresa>
	</Kompanija>
	<Email dostupnost="privatni"></Email>
</Artikal>
</Magacin>